{"$schema":"https://json-schema.org/draft/2020-12/schema","$id":"provan.session10_runtime_invariant_evidence.v1","type":"object","required":["schema_id","invariant","fixture_class","scenario","adversarial_operation","expected_error","observed_error","command","exit_code","transcript","transcript_sha256","production_test_ids","artifact_evidence","limitations"],"properties":{"schema_id":{"const":"provan.session10_runtime_invariant_evidence.v1"},"invariant":{"type":"string","minLength":1},"fixture_class":{"enum":["valid","near-valid","adversarial","schema-invalid","schema-valid-python-invalid"]},"scenario":{"enum":["supported_success","bounded_limitation","prohibited_or_invalid_input_rejected"]},"adversarial_operation":{"type":["string","null"]},"expected_error":{"type":["string","null"]},"observed_error":{"type":["string","null"]},"command":{"type":"string","minLength":1},"exit_code":{"type":"integer"},"transcript":{"type":"string","minLength":1},"transcript_sha256":{"pattern":"^sha256:[0-9a-f]{64}$"},"production_test_ids":{"type":"array","minItems":1,"items":{"type":"string","minLength":1},"uniqueItems":true},"artifact_evidence":{"type":"array","items":{"type":"object","required":["name","sha256","content"],"properties":{"name":{"type":"string","minLength":1},"sha256":{"pattern":"^sha256:[0-9a-f]{64}$"},"content":{"type":"string"}},"additionalProperties":false}},"limitations":{"type":"array","items":{"type":"string"}}},"additionalProperties":false}
