{"adversarial_operation":null,"artifact_evidence":[],"command":"<PYTHON_EXECUTABLE> -m pytest -vv -s tests/test_session10_runtime_near_cases.py::test_near_session9_successor_preservation","exit_code":0,"expected_error":null,"fixture_class":"near-valid","invariant":"session9_successor_preservation","limitations":["UNCHANGED_HISTORICAL_CORRECTION_REVALIDATED"],"observed_error":null,"production_test_ids":["tests/test_session10_runtime_near_cases.py::test_near_session9_successor_preservation"],"scenario":"bounded_limitation","schema_id":"provan.session10_runtime_invariant_evidence.v1","transcript":"============================= test session starts =============================\nplatform win32 -- Python 3.11.9, pytest-9.1.1, pluggy-1.6.0 -- <PYTHON_EXECUTABLE>\ncachedir: .pytest_cache\nrootdir: <REPOSITORY_ROOT>\nconfigfile: pyproject.toml\nplugins: anyio-4.12.1\ncollecting ... collected 1 item\n\ntests/test_session10_runtime_near_cases.py::test_near_session9_successor_preservation NEAR_VALID_OBSERVED:session9_successor_preservation:UNCHANGED_HISTORICAL_CORRECTION_REVALIDATED\nPASSED\n\n============================== 1 passed in 5.22s ==============================\n","transcript_sha256":"sha256:185cbc73b3f494f405bb851b4e3351d51929abbfef72588c90a6d91a0a34050d"}
