{"adversarial_operation":null,"artifact_evidence":[],"command":"<PYTHON_EXECUTABLE> -m pytest -vv -s tests/test_session10_change_brief.py::test_context_record_and_bundle_valid_controlled_case","exit_code":0,"expected_error":null,"fixture_class":"valid","invariant":"context_bundle_case_binding","limitations":[],"observed_error":null,"production_test_ids":["tests/test_session10_change_brief.py::test_context_record_and_bundle_valid_controlled_case"],"scenario":"supported_success","schema_id":"provan.session10_runtime_invariant_evidence.v1","transcript":"============================= test session starts =============================\nplatform win32 -- Python 3.11.9, pytest-9.1.1, pluggy-1.6.0 -- <PYTHON_EXECUTABLE>\ncachedir: .pytest_cache\nrootdir: <REPOSITORY_ROOT>\nconfigfile: pyproject.toml\nplugins: anyio-4.12.1\ncollecting ... collected 1 item\n\ntests/test_session10_change_brief.py::test_context_record_and_bundle_valid_controlled_case PASSED\n\n============================== 1 passed in 1.72s ==============================\n","transcript_sha256":"sha256:4fbf56113fbb626c56734c724b87f9d5b82c0415cb3930cfc1f132697d55290d"}
