{"adversarial_operation":null,"artifact_evidence":[],"command":"<PYTHON_EXECUTABLE> -m pytest -vv -s tests/test_session10_runtime_near_cases.py::test_near_forbidden_capability_absence[verifier_capability_absence-verify]","exit_code":0,"expected_error":null,"fixture_class":"near-valid","invariant":"verifier_capability_absence","limitations":["SUPPORTED_EXPLAIN_ADJACENT_TO_ABSENT_FORBIDDEN_COMMAND"],"observed_error":null,"production_test_ids":["tests/test_session10_runtime_near_cases.py::test_near_forbidden_capability_absence[verifier_capability_absence-verify]"],"scenario":"bounded_limitation","schema_id":"provan.session10_runtime_invariant_evidence.v1","transcript":"============================= test session starts =============================\nplatform win32 -- Python 3.11.9, pytest-9.1.1, pluggy-1.6.0 -- <PYTHON_EXECUTABLE>\ncachedir: .pytest_cache\nrootdir: <REPOSITORY_ROOT>\nconfigfile: pyproject.toml\nplugins: anyio-4.12.1\ncollecting ... collected 1 item\n\ntests/test_session10_runtime_near_cases.py::test_near_forbidden_capability_absence[verifier_capability_absence-verify] NEAR_VALID_OBSERVED:verifier_capability_absence:SUPPORTED_EXPLAIN_ADJACENT_TO_ABSENT_FORBIDDEN_COMMAND\nPASSED\n\n============================== 1 passed in 0.07s ==============================\n","transcript_sha256":"sha256:5635a07c2c45985d36c2a7196228fbe1e2b25a9d061cce3b3007ec5445536812"}
