{"adversarial_operation":"tests/test_session10_change_brief.py::test_pr_metadata_transport_spy_and_adversarial_boundaries","artifact_evidence":[],"command":"<PYTHON_EXECUTABLE> -m pytest -vv -s tests/test_session10_change_brief.py::test_pr_metadata_transport_spy_and_adversarial_boundaries","exit_code":0,"expected_error":"PR_TRANSPORT_BOUNDARIES_REJECTED","fixture_class":"adversarial","invariant":"credential_free_remote_and_pr_resolution","limitations":[],"observed_error":"PR_TRANSPORT_BOUNDARIES_REJECTED","production_test_ids":["tests/test_session10_change_brief.py::test_pr_metadata_transport_spy_and_adversarial_boundaries"],"scenario":"prohibited_or_invalid_input_rejected","schema_id":"provan.session10_runtime_invariant_evidence.v1","transcript":"============================= test session starts =============================\nplatform win32 -- Python 3.11.9, pytest-9.1.1, pluggy-1.6.0 -- <PYTHON_EXECUTABLE>\ncachedir: .pytest_cache\nrootdir: <REPOSITORY_ROOT>\nconfigfile: pyproject.toml\nplugins: anyio-4.12.1\ncollecting ... collected 1 item\n\ntests/test_session10_change_brief.py::test_pr_metadata_transport_spy_and_adversarial_boundaries ADVERSARIAL_REJECTION_OBSERVED:credential_free_remote_and_pr_resolution:PR_TRANSPORT_BOUNDARIES_REJECTED\nPASSED\n\n============================== 1 passed in 0.15s ==============================\n","transcript_sha256":"sha256:b7d5c2d751fe2812ff9d54f4f185a738caa93341396593fb041cee4f592c0bec"}
