{"adversarial_operation":null,"artifact_evidence":[],"command":"<PYTHON_EXECUTABLE> -m pytest -vv -s tests/test_session10_proof_invariants.py::test_all_major_semantic_invalid_cases_are_observed","exit_code":0,"expected_error":null,"fixture_class":"valid","invariant":"independent_semantic_recomputation","limitations":[],"observed_error":null,"production_test_ids":["tests/test_session10_proof_invariants.py::test_all_major_semantic_invalid_cases_are_observed"],"scenario":"supported_success","schema_id":"provan.session10_runtime_invariant_evidence.v1","transcript":"============================= test session starts =============================\nplatform win32 -- Python 3.11.9, pytest-9.1.1, pluggy-1.6.0 -- <PYTHON_EXECUTABLE>\ncachedir: .pytest_cache\nrootdir: <REPOSITORY_ROOT>\nconfigfile: pyproject.toml\nplugins: anyio-4.12.1\ncollecting ... collected 1 item\n\ntests/test_session10_proof_invariants.py::test_all_major_semantic_invalid_cases_are_observed ADVERSARIAL_REJECTION_OBSERVED:independent_semantic_recomputation:ALL_MAJOR_SEMANTIC_INVALID_CASES_REJECTED\nPASSED\n\n============================== 1 passed in 0.20s ==============================\n","transcript_sha256":"sha256:14f88bc463d2f091de81cbd53424f4315e71ebedb3cbef872170da3ca4a5c6f3"}
