{"adversarial_operation":null,"artifact_evidence":[],"command":"<PYTHON_EXECUTABLE> -m pytest -vv -s tests/test_session10_runtime_near_cases.py::test_near_public_projection_boundary","exit_code":0,"expected_error":null,"fixture_class":"near-valid","invariant":"challenge_private_eval_projection_exclusion","limitations":["SAFE_AGGREGATE_WITH_LOCAL_DETAILS_WITHHELD"],"observed_error":null,"production_test_ids":["tests/test_session10_runtime_near_cases.py::test_near_public_projection_boundary"],"scenario":"bounded_limitation","schema_id":"provan.session10_runtime_invariant_evidence.v1","transcript":"============================= test session starts =============================\nplatform win32 -- Python 3.11.9, pytest-9.1.1, pluggy-1.6.0 -- <PYTHON_EXECUTABLE>\ncachedir: .pytest_cache\nrootdir: <REPOSITORY_ROOT>\nconfigfile: pyproject.toml\nplugins: anyio-4.12.1\ncollecting ... collected 1 item\n\ntests/test_session10_runtime_near_cases.py::test_near_public_projection_boundary NEAR_VALID_OBSERVED:challenge_private_eval_projection_exclusion:SAFE_AGGREGATE_WITH_LOCAL_DETAILS_WITHHELD\nPASSED\n\n============================== 1 passed in 1.38s ==============================\n","transcript_sha256":"sha256:9329f8c9c842b94528bb79d1102328477ca9d4e9f8d0ecb26d5c6fc13915033d"}
