{"adversarial_operation":null,"artifact_evidence":[],"command":"<PYTHON_EXECUTABLE> -m pytest -vv -s tests/test_session10_change_brief.py::test_common_safe_reader_rejects_type_size_encoding_and_link tests/test_session10_change_brief.py::test_safe_reader_reparse_detection_is_deterministic tests/test_session10_change_brief.py::test_safe_reader_symlink_detection_without_platform_privilege tests/test_session10_change_brief.py::test_safe_reader_revalidates_parent_components_after_open","exit_code":0,"expected_error":null,"fixture_class":"valid","invariant":"literal_file_disambiguation_and_safe_reader","limitations":[],"observed_error":null,"production_test_ids":["tests/test_session10_change_brief.py::test_common_safe_reader_rejects_type_size_encoding_and_link","tests/test_session10_change_brief.py::test_safe_reader_reparse_detection_is_deterministic","tests/test_session10_change_brief.py::test_safe_reader_symlink_detection_without_platform_privilege","tests/test_session10_change_brief.py::test_safe_reader_revalidates_parent_components_after_open"],"scenario":"supported_success","schema_id":"provan.session10_runtime_invariant_evidence.v1","transcript":"============================= test session starts =============================\nplatform win32 -- Python 3.11.9, pytest-9.1.1, pluggy-1.6.0 -- <PYTHON_EXECUTABLE>\ncachedir: .pytest_cache\nrootdir: <REPOSITORY_ROOT>\nconfigfile: pyproject.toml\nplugins: anyio-4.12.1\ncollecting ... collected 4 items\n\ntests/test_session10_change_brief.py::test_common_safe_reader_rejects_type_size_encoding_and_link SKIPPED\ntests/test_session10_change_brief.py::test_safe_reader_reparse_detection_is_deterministic PASSED\ntests/test_session10_change_brief.py::test_safe_reader_symlink_detection_without_platform_privilege ADVERSARIAL_REJECTION_OBSERVED:literal_file_disambiguation_and_safe_reader:INPUT_FILE_PATH_UNSAFE\nPASSED\ntests/test_session10_change_brief.py::test_safe_reader_revalidates_parent_components_after_open PASSED\n\n======================== 3 passed, 1 skipped in 0.19s =========================\n","transcript_sha256":"sha256:f9ab529e7eb608f615b6a95b2d11b1f138154ce1f596a529d294e40698384158"}
