{"adversarial_operation":null,"artifact_evidence":[],"command":"<PYTHON_EXECUTABLE> -m pytest -vv -s tests/test_session10_runtime_near_cases.py::test_near_independent_semantic_recomputation","exit_code":0,"expected_error":null,"fixture_class":"near-valid","invariant":"independent_semantic_recomputation","limitations":["STATIC_INDEPENDENCE_WITH_SERIALIZED_ONLY_INPUTS"],"observed_error":null,"production_test_ids":["tests/test_session10_runtime_near_cases.py::test_near_independent_semantic_recomputation"],"scenario":"bounded_limitation","schema_id":"provan.session10_runtime_invariant_evidence.v1","transcript":"============================= test session starts =============================\nplatform win32 -- Python 3.11.9, pytest-9.1.1, pluggy-1.6.0 -- <PYTHON_EXECUTABLE>\ncachedir: .pytest_cache\nrootdir: <REPOSITORY_ROOT>\nconfigfile: pyproject.toml\nplugins: anyio-4.12.1\ncollecting ... collected 1 item\n\ntests/test_session10_runtime_near_cases.py::test_near_independent_semantic_recomputation NEAR_VALID_OBSERVED:independent_semantic_recomputation:STATIC_INDEPENDENCE_WITH_SERIALIZED_ONLY_INPUTS\nPASSED\n\n============================== 1 passed in 0.09s ==============================\n","transcript_sha256":"sha256:306f632aeb8b579bb28d62afb96c91300d611dc4269838d49e0fc35538f8eea4"}
