{"adversarial_operation":null,"artifact_evidence":[],"command":"<PYTHON_EXECUTABLE> -m pytest -vv -s tests/test_session10_runtime_near_cases.py::test_near_private_planning_absence","exit_code":0,"expected_error":null,"fixture_class":"near-valid","invariant":"private_planning_authority_absence","limitations":["GENERIC_PUBLIC_AUTHORITY_SURFACE_PASSES_LEAKAGE_POLICY"],"observed_error":null,"production_test_ids":["tests/test_session10_runtime_near_cases.py::test_near_private_planning_absence"],"scenario":"bounded_limitation","schema_id":"provan.session10_runtime_invariant_evidence.v1","transcript":"============================= test session starts =============================\nplatform win32 -- Python 3.11.9, pytest-9.1.1, pluggy-1.6.0 -- <PYTHON_EXECUTABLE>\ncachedir: .pytest_cache\nrootdir: <REPOSITORY_ROOT>\nconfigfile: pyproject.toml\nplugins: anyio-4.12.1\ncollecting ... collected 1 item\n\ntests/test_session10_runtime_near_cases.py::test_near_private_planning_absence NEAR_VALID_OBSERVED:private_planning_authority_absence:GENERIC_PUBLIC_AUTHORITY_SURFACE_PASSES_LEAKAGE_POLICY\nPASSED\n\n============================== 1 passed in 0.07s ==============================\n","transcript_sha256":"sha256:58a97370d9ff58c4de806a45fc5faf5c738129432324da8221a8e2ebc59211ca"}
