{"adversarial_operation":"tests/test_session10_change_brief.py::test_context_record_and_bundle_semantics_from_controlled_case","artifact_evidence":[],"command":"<PYTHON_EXECUTABLE> -m pytest -vv -s tests/test_session10_change_brief.py::test_context_record_and_bundle_semantics_from_controlled_case","exit_code":0,"expected_error":"CONTEXT_CASE_BINDING_INVALID","fixture_class":"adversarial","invariant":"context_bundle_case_binding","limitations":[],"observed_error":"CONTEXT_CASE_BINDING_INVALID","production_test_ids":["tests/test_session10_change_brief.py::test_context_record_and_bundle_semantics_from_controlled_case"],"scenario":"prohibited_or_invalid_input_rejected","schema_id":"provan.session10_runtime_invariant_evidence.v1","transcript":"============================= test session starts =============================\nplatform win32 -- Python 3.11.9, pytest-9.1.1, pluggy-1.6.0 -- <PYTHON_EXECUTABLE>\ncachedir: .pytest_cache\nrootdir: <REPOSITORY_ROOT>\nconfigfile: pyproject.toml\nplugins: anyio-4.12.1\ncollecting ... collected 1 item\n\ntests/test_session10_change_brief.py::test_context_record_and_bundle_semantics_from_controlled_case ADVERSARIAL_REJECTION_OBSERVED:context_record_semantics:CONTEXT_RECORD_SEMANTICS_INVALID\nADVERSARIAL_REJECTION_OBSERVED:context_bundle_case_binding:CONTEXT_CASE_BINDING_INVALID\nPASSED\n\n============================== 1 passed in 1.56s ==============================\n","transcript_sha256":"sha256:bbf884cee19752d7dd1d40bd7aba7f19d757e8852bc5797e0d7069b0211f4c14"}
