{"adversarial_operation":null,"artifact_evidence":[],"command":"<PYTHON_EXECUTABLE> -m pytest -vv -s tests/test_session10_runtime_near_cases.py::test_near_forbidden_capability_absence[challenge_capability_absence-challenge]","exit_code":0,"expected_error":null,"fixture_class":"near-valid","invariant":"challenge_capability_absence","limitations":["SUPPORTED_EXPLAIN_ADJACENT_TO_ABSENT_FORBIDDEN_COMMAND"],"observed_error":null,"production_test_ids":["tests/test_session10_runtime_near_cases.py::test_near_forbidden_capability_absence[challenge_capability_absence-challenge]"],"scenario":"bounded_limitation","schema_id":"provan.session10_runtime_invariant_evidence.v1","transcript":"============================= test session starts =============================\nplatform win32 -- Python 3.11.9, pytest-9.1.1, pluggy-1.6.0 -- <PYTHON_EXECUTABLE>\ncachedir: .pytest_cache\nrootdir: <REPOSITORY_ROOT>\nconfigfile: pyproject.toml\nplugins: anyio-4.12.1\ncollecting ... collected 1 item\n\ntests/test_session10_runtime_near_cases.py::test_near_forbidden_capability_absence[challenge_capability_absence-challenge] NEAR_VALID_OBSERVED:challenge_capability_absence:SUPPORTED_EXPLAIN_ADJACENT_TO_ABSENT_FORBIDDEN_COMMAND\nPASSED\n\n============================== 1 passed in 0.07s ==============================\n","transcript_sha256":"sha256:9c2d98e66f1800b68ff02e44065d3ac4827865b4b1867e07c7553403725efb0e"}
