{"adversarial_operation":null,"artifact_evidence":[],"command":"<PYTHON_EXECUTABLE> -m pytest -vv -s tests/test_session9_correction.py::test_c9f_resolves_immutable_historical_registry_without_rewriting_it","exit_code":0,"expected_error":null,"fixture_class":"valid","invariant":"session9_successor_preservation","limitations":[],"observed_error":null,"production_test_ids":["tests/test_session9_correction.py::test_c9f_resolves_immutable_historical_registry_without_rewriting_it"],"scenario":"supported_success","schema_id":"provan.session10_runtime_invariant_evidence.v1","transcript":"============================= test session starts =============================\nplatform win32 -- Python 3.11.9, pytest-9.1.1, pluggy-1.6.0 -- <PYTHON_EXECUTABLE>\ncachedir: .pytest_cache\nrootdir: <REPOSITORY_ROOT>\nconfigfile: pyproject.toml\nplugins: anyio-4.12.1\ncollecting ... collected 1 item\n\ntests/test_session9_correction.py::test_c9f_resolves_immutable_historical_registry_without_rewriting_it PASSED\n\n============================== 1 passed in 0.14s ==============================\n","transcript_sha256":"sha256:04b63ed29b5b9aa2c4c3f43ed620eb46ecd10fa3844af1677012229a2e7f59c9"}
