{"adversarial_operation":null,"artifact_evidence":[],"command":"<PYTHON_EXECUTABLE> -m pytest -vv -s tests/test_session10_runtime_near_cases.py::test_near_bounded_noncoverage","exit_code":0,"expected_error":null,"fixture_class":"near-valid","invariant":"bounded_noncoverage_reporting","limitations":["GLOBAL_ENTITY_LIMIT_EXPLICIT"],"observed_error":null,"production_test_ids":["tests/test_session10_runtime_near_cases.py::test_near_bounded_noncoverage"],"scenario":"bounded_limitation","schema_id":"provan.session10_runtime_invariant_evidence.v1","transcript":"============================= test session starts =============================\nplatform win32 -- Python 3.11.9, pytest-9.1.1, pluggy-1.6.0 -- <PYTHON_EXECUTABLE>\ncachedir: .pytest_cache\nrootdir: <REPOSITORY_ROOT>\nconfigfile: pyproject.toml\nplugins: anyio-4.12.1\ncollecting ... collected 1 item\n\ntests/test_session10_runtime_near_cases.py::test_near_bounded_noncoverage NEAR_VALID_OBSERVED:bounded_noncoverage_reporting:GLOBAL_ENTITY_LIMIT_EXPLICIT\nPASSED\n\n============================== 1 passed in 0.06s ==============================\n","transcript_sha256":"sha256:5ce11082529f44963464fa99bb1b681e13dc8aba369c7bc8d60fbd260433c9ff"}
