{"adversarial_operation":null,"artifact_evidence":[],"command":"<PYTHON_EXECUTABLE> -m pytest -vv -s tests/test_session10_change_brief.py::test_local_analysis_never_runs_git_in_the_inspected_target","exit_code":0,"expected_error":null,"fixture_class":"valid","invariant":"source_only_target_immutability","limitations":[],"observed_error":null,"production_test_ids":["tests/test_session10_change_brief.py::test_local_analysis_never_runs_git_in_the_inspected_target"],"scenario":"supported_success","schema_id":"provan.session10_runtime_invariant_evidence.v1","transcript":"============================= test session starts =============================\nplatform win32 -- Python 3.11.9, pytest-9.1.1, pluggy-1.6.0 -- <PYTHON_EXECUTABLE>\ncachedir: .pytest_cache\nrootdir: <REPOSITORY_ROOT>\nconfigfile: pyproject.toml\nplugins: anyio-4.12.1\ncollecting ... collected 1 item\n\ntests/test_session10_change_brief.py::test_local_analysis_never_runs_git_in_the_inspected_target ADVERSARIAL_REJECTION_OBSERVED:source_only_target_immutability:TARGET_STATE_UNCHANGED\nPASSED\n\n============================== 1 passed in 1.73s ==============================\n","transcript_sha256":"sha256:6407547ca7efdf09c5d37a6aec7d69a84b324c6c5fb3877ab102f39b3ca332e0"}
