{"adversarial_operation":"tests/test_session10_change_brief.py::test_forbidden_session10_capability_is_unreachable[challenge]","artifact_evidence":[],"command":"<PYTHON_EXECUTABLE> -m pytest -vv -s tests/test_session10_change_brief.py::test_forbidden_session10_capability_is_unreachable[challenge]","exit_code":0,"expected_error":"ARGPARSE_EXIT_2","fixture_class":"adversarial","invariant":"challenge_capability_absence","limitations":[],"observed_error":"ARGPARSE_EXIT_2","production_test_ids":["tests/test_session10_change_brief.py::test_forbidden_session10_capability_is_unreachable[challenge]"],"scenario":"prohibited_or_invalid_input_rejected","schema_id":"provan.session10_runtime_invariant_evidence.v1","transcript":"============================= test session starts =============================\nplatform win32 -- Python 3.11.9, pytest-9.1.1, pluggy-1.6.0 -- <PYTHON_EXECUTABLE>\ncachedir: .pytest_cache\nrootdir: <REPOSITORY_ROOT>\nconfigfile: pyproject.toml\nplugins: anyio-4.12.1\ncollecting ... collected 1 item\n\ntests/test_session10_change_brief.py::test_forbidden_session10_capability_is_unreachable[challenge] ADVERSARIAL_REJECTION_OBSERVED:challenge_capability_absence:ARGPARSE_EXIT_2\nPASSED\n\n============================== 1 passed in 0.18s ==============================\nusage: provan [-h] {doctor,repository,telemetry,explain,acceptance} ...\nprovan: error: argument command: invalid choice: 'challenge' (choose from 'doctor', 'repository', 'telemetry', 'explain', 'acceptance')\n","transcript_sha256":"sha256:3d5de8e1e840c6f15daefa49a50429be9a49a2dc93f06c0bf05c594a7c5430c9"}
