{"adversarial_operation":null,"artifact_evidence":[],"command":"<PYTHON_EXECUTABLE> -m pytest -vv -s tests/test_session10_change_brief.py::test_mutable_sensitive_classes_are_excluded_without_opening","exit_code":0,"expected_error":null,"fixture_class":"valid","invariant":"mutable_candidate_coverage_and_nonread","limitations":[],"observed_error":null,"production_test_ids":["tests/test_session10_change_brief.py::test_mutable_sensitive_classes_are_excluded_without_opening"],"scenario":"supported_success","schema_id":"provan.session10_runtime_invariant_evidence.v1","transcript":"============================= test session starts =============================\nplatform win32 -- Python 3.11.9, pytest-9.1.1, pluggy-1.6.0 -- <PYTHON_EXECUTABLE>\ncachedir: .pytest_cache\nrootdir: <REPOSITORY_ROOT>\nconfigfile: pyproject.toml\nplugins: anyio-4.12.1\ncollecting ... collected 1 item\n\ntests/test_session10_change_brief.py::test_mutable_sensitive_classes_are_excluded_without_opening ADVERSARIAL_REJECTION_OBSERVED:mutable_candidate_coverage_and_nonread:MUTABLE_SENSITIVE_CONTENT_NOT_READ\nPASSED\n\n============================== 1 passed in 1.66s ==============================\n","transcript_sha256":"sha256:b2e8d36feed5b74cb5ce9d662a241a8384d55b4f130e3495361db74389c2a7b0"}
