{"adversarial_operation":"tests/test_session10_change_brief.py::test_forbidden_session10_capability_is_unreachable[enterprise]","artifact_evidence":[],"command":"<PYTHON_EXECUTABLE> -m pytest -vv -s tests/test_session10_change_brief.py::test_forbidden_session10_capability_is_unreachable[enterprise]","exit_code":0,"expected_error":"ARGPARSE_EXIT_2","fixture_class":"adversarial","invariant":"enterprise_capability_absence","limitations":[],"observed_error":"ARGPARSE_EXIT_2","production_test_ids":["tests/test_session10_change_brief.py::test_forbidden_session10_capability_is_unreachable[enterprise]"],"scenario":"prohibited_or_invalid_input_rejected","schema_id":"provan.session10_runtime_invariant_evidence.v1","transcript":"============================= test session starts =============================\nplatform win32 -- Python 3.11.9, pytest-9.1.1, pluggy-1.6.0 -- <PYTHON_EXECUTABLE>\ncachedir: .pytest_cache\nrootdir: <REPOSITORY_ROOT>\nconfigfile: pyproject.toml\nplugins: anyio-4.12.1\ncollecting ... collected 1 item\n\ntests/test_session10_change_brief.py::test_forbidden_session10_capability_is_unreachable[enterprise] ADVERSARIAL_REJECTION_OBSERVED:enterprise_capability_absence:ARGPARSE_EXIT_2\nPASSED\n\n============================== 1 passed in 0.21s ==============================\nusage: provan [-h] {doctor,repository,telemetry,explain,acceptance} ...\nprovan: error: argument command: invalid choice: 'enterprise' (choose from 'doctor', 'repository', 'telemetry', 'explain', 'acceptance')\n","transcript_sha256":"sha256:2939103d9f2c9b848be74cb4b96b8fb16e23c93e533425a9e093b4ba75c8d5d0"}
