{"adversarial_operation":"tests/test_session10_change_brief.py::test_safe_reader_symlink_detection_without_platform_privilege","artifact_evidence":[],"command":"<PYTHON_EXECUTABLE> -m pytest -vv -s tests/test_session10_change_brief.py::test_safe_reader_symlink_detection_without_platform_privilege","exit_code":0,"expected_error":"INPUT_FILE_PATH_UNSAFE","fixture_class":"adversarial","invariant":"literal_file_disambiguation_and_safe_reader","limitations":[],"observed_error":"INPUT_FILE_PATH_UNSAFE","production_test_ids":["tests/test_session10_change_brief.py::test_safe_reader_symlink_detection_without_platform_privilege"],"scenario":"prohibited_or_invalid_input_rejected","schema_id":"provan.session10_runtime_invariant_evidence.v1","transcript":"============================= test session starts =============================\nplatform win32 -- Python 3.11.9, pytest-9.1.1, pluggy-1.6.0 -- <PYTHON_EXECUTABLE>\ncachedir: .pytest_cache\nrootdir: <REPOSITORY_ROOT>\nconfigfile: pyproject.toml\nplugins: anyio-4.12.1\ncollecting ... collected 1 item\n\ntests/test_session10_change_brief.py::test_safe_reader_symlink_detection_without_platform_privilege ADVERSARIAL_REJECTION_OBSERVED:literal_file_disambiguation_and_safe_reader:INPUT_FILE_PATH_UNSAFE\nPASSED\n\n============================== 1 passed in 0.19s ==============================\n","transcript_sha256":"sha256:105bd59f021413c33e8e92e34951de22af43a705a20efeaa37f9fcaef2ea53ea"}
