{"adversarial_operation":null,"artifact_evidence":[],"command":"<PYTHON_EXECUTABLE> -m pytest -vv -s tests/test_session10_runtime_near_cases.py::test_near_renderer_fidelity","exit_code":0,"expected_error":null,"fixture_class":"near-valid","invariant":"claim_classes_and_renderer_fidelity","limitations":["EMPTY_CLAIM_CLASSES_RENDERED_EXPLICITLY"],"observed_error":null,"production_test_ids":["tests/test_session10_runtime_near_cases.py::test_near_renderer_fidelity"],"scenario":"bounded_limitation","schema_id":"provan.session10_runtime_invariant_evidence.v1","transcript":"============================= test session starts =============================\nplatform win32 -- Python 3.11.9, pytest-9.1.1, pluggy-1.6.0 -- <PYTHON_EXECUTABLE>\ncachedir: .pytest_cache\nrootdir: <REPOSITORY_ROOT>\nconfigfile: pyproject.toml\nplugins: anyio-4.12.1\ncollecting ... collected 1 item\n\ntests/test_session10_runtime_near_cases.py::test_near_renderer_fidelity NEAR_VALID_OBSERVED:claim_classes_and_renderer_fidelity:EMPTY_CLAIM_CLASSES_RENDERED_EXPLICITLY\nPASSED\n\n============================== 1 passed in 1.64s ==============================\n","transcript_sha256":"sha256:e2e27c42aee35723cda7c66bddcfd473a42b81a45d2560502b8cfa29960546ab"}
