{"adversarial_operation":"tests/test_session10_change_brief.py::test_public_projection_rejects_challenge_and_private_eval_material","artifact_evidence":[],"command":"<PYTHON_EXECUTABLE> -m pytest -vv -s tests/test_session10_change_brief.py::test_public_projection_rejects_challenge_and_private_eval_material","exit_code":0,"expected_error":"PUBLIC_PROJECTION_CHALLENGE_MATERIAL_FORBIDDEN","fixture_class":"adversarial","invariant":"challenge_private_eval_projection_exclusion","limitations":[],"observed_error":"PUBLIC_PROJECTION_CHALLENGE_MATERIAL_FORBIDDEN","production_test_ids":["tests/test_session10_change_brief.py::test_public_projection_rejects_challenge_and_private_eval_material"],"scenario":"prohibited_or_invalid_input_rejected","schema_id":"provan.session10_runtime_invariant_evidence.v1","transcript":"============================= test session starts =============================\nplatform win32 -- Python 3.11.9, pytest-9.1.1, pluggy-1.6.0 -- <PYTHON_EXECUTABLE>\ncachedir: .pytest_cache\nrootdir: <REPOSITORY_ROOT>\nconfigfile: pyproject.toml\nplugins: anyio-4.12.1\ncollecting ... collected 1 item\n\ntests/test_session10_change_brief.py::test_public_projection_rejects_challenge_and_private_eval_material ADVERSARIAL_REJECTION_OBSERVED:challenge_private_eval_projection_exclusion:PUBLIC_PROJECTION_CHALLENGE_MATERIAL_FORBIDDEN\nPASSED\n\n============================== 1 passed in 2.29s ==============================\n","transcript_sha256":"sha256:4a1c69f87cbc71b46d806569ca813ce506ad17d4eef3a0ab556cd20a2424c347"}
