{"adversarial_operation":"tests/test_session10_change_brief.py::test_immutable_candidate_requires_exact_full_commit_identities","artifact_evidence":[],"command":"<PYTHON_EXECUTABLE> -m pytest -vv -s tests/test_session10_change_brief.py::test_immutable_candidate_requires_exact_full_commit_identities","exit_code":0,"expected_error":"PINNED_COMMIT_REQUIRED","fixture_class":"adversarial","invariant":"immutable_full_commit_identity","limitations":[],"observed_error":"PINNED_COMMIT_REQUIRED","production_test_ids":["tests/test_session10_change_brief.py::test_immutable_candidate_requires_exact_full_commit_identities"],"scenario":"prohibited_or_invalid_input_rejected","schema_id":"provan.session10_runtime_invariant_evidence.v1","transcript":"============================= test session starts =============================\nplatform win32 -- Python 3.11.9, pytest-9.1.1, pluggy-1.6.0 -- <PYTHON_EXECUTABLE>\ncachedir: .pytest_cache\nrootdir: <REPOSITORY_ROOT>\nconfigfile: pyproject.toml\nplugins: anyio-4.12.1\ncollecting ... collected 1 item\n\ntests/test_session10_change_brief.py::test_immutable_candidate_requires_exact_full_commit_identities ADVERSARIAL_REJECTION_OBSERVED:immutable_full_commit_identity:PINNED_COMMIT_REQUIRED\nPASSED\n\n============================== 1 passed in 1.79s ==============================\n","transcript_sha256":"sha256:236a22b8a8ca84bc73113a362081a2f4d74b21a50d98349f1cbac7651fa4f43f"}
