{"adversarial_operation":null,"artifact_evidence":[],"command":"<PYTHON_EXECUTABLE> -m pytest -vv -s tests/test_session10_runtime_near_cases.py::test_near_wheel_dependency_boundary","exit_code":0,"expected_error":null,"fixture_class":"near-valid","invariant":"authoritative_wheel_maturity_and_dependency_boundary","limitations":["UNPUBLISHED_MAIN_PACKAGE_WITH_PROVAN_ONLY_INCLUDE"],"observed_error":null,"production_test_ids":["tests/test_session10_runtime_near_cases.py::test_near_wheel_dependency_boundary"],"scenario":"bounded_limitation","schema_id":"provan.session10_runtime_invariant_evidence.v1","transcript":"============================= test session starts =============================\nplatform win32 -- Python 3.11.9, pytest-9.1.1, pluggy-1.6.0 -- <PYTHON_EXECUTABLE>\ncachedir: .pytest_cache\nrootdir: <REPOSITORY_ROOT>\nconfigfile: pyproject.toml\nplugins: anyio-4.12.1\ncollecting ... collected 1 item\n\ntests/test_session10_runtime_near_cases.py::test_near_wheel_dependency_boundary NEAR_VALID_OBSERVED:authoritative_wheel_maturity_and_dependency_boundary:UNPUBLISHED_MAIN_PACKAGE_WITH_PROVAN_ONLY_INCLUDE\nPASSED\n\n============================== 1 passed in 0.07s ==============================\n","transcript_sha256":"sha256:406c06e31942fca50f6fcd282758e341faed85e9a8172b7bf05de04c37366112"}
