{"adversarial_operation":null,"artifact_evidence":[],"command":"<PYTHON_EXECUTABLE> -m pytest -vv -s tests/test_session10_runtime_near_cases.py::test_near_context_bundle_case_binding","exit_code":0,"expected_error":null,"fixture_class":"near-valid","invariant":"context_bundle_case_binding","limitations":["EMPTY_CASE_LOCAL_BUNDLE_WITH_EXPLICIT_LIMIT_ARRAYS"],"observed_error":null,"production_test_ids":["tests/test_session10_runtime_near_cases.py::test_near_context_bundle_case_binding"],"scenario":"bounded_limitation","schema_id":"provan.session10_runtime_invariant_evidence.v1","transcript":"============================= test session starts =============================\nplatform win32 -- Python 3.11.9, pytest-9.1.1, pluggy-1.6.0 -- <PYTHON_EXECUTABLE>\ncachedir: .pytest_cache\nrootdir: <REPOSITORY_ROOT>\nconfigfile: pyproject.toml\nplugins: anyio-4.12.1\ncollecting ... collected 1 item\n\ntests/test_session10_runtime_near_cases.py::test_near_context_bundle_case_binding NEAR_VALID_OBSERVED:context_bundle_case_binding:EMPTY_CASE_LOCAL_BUNDLE_WITH_EXPLICIT_LIMIT_ARRAYS\nPASSED\n\n============================== 1 passed in 1.56s ==============================\n","transcript_sha256":"sha256:3d36536bbfec92de054b62500861372971be9dd020c55507f9d9f677dfabc681"}
